title,link,description
Uống sữa bò có tốt không? Những lợi ích cho sức khỏe,https://www.bachhoaxanh.com/kinh-nghiem-hay/uong-sua-bo-co-tot-khong-1032482,"Cải thiện sức khỏe tim mạch: Vì sữa bò có chứa Kali nên uống sữa bò được chứng minh là giúp bạn giảm huyết áp, từ đó giảm nguy cơ mắc bệnh tim mạch. · Xương chắc ..."
Sữa thực vật và sữa bò: Loại nào tốt cho bạn? - Vinmec,https://www.vinmec.com/tin-tuc/thong-tin-suc-khoe/dinh-duong/sua-thuc-vat-va-sua-bo-loai-nao-tot-cho-ban/,"Sữa bò có nhiều protein mà con người cần trong chế độ ăn uống của họ. Một số loại sữa làm từ thực vật rất ít protein, có thể là một vấn đề đáng lo ngại đối với ..."
Tác hại của sữa bò: Nên hay không bỏ sữa khỏi chế độ dinh ...,https://hellobacsi.com/an-uong-lanh-manh/thong-tin-dinh-duong/tac-hai-cua-sua-bo-nen-hay-khong-bo-sua-khoi-che-do-dinh-duong/,"19 thg 2, 2020 — 19 thg 2, 2020Sữa bò là thức uống quen thuộc đối với mọi đối tượng người dùng. Từ hàng thập kỷ trước đến nay, người tiêu dùng luôn được tiếp cận với những ..."
7 tác hại của sữa bò đối với sức khỏe có thể bạn chưa biết,https://yeutre.vn/bai-viet/7-tac-hai-cua-sua-bo-doi-voi-suc-khoe-co-the-ban-chua-biet.29386/,"1 thg 4, 2022 — 1 thg 4, 2022Sữa bò chứa lượng Cholesterol cao, gây gia tăng bệnh tim, đột quỵ, tiểu đường và béo phì. · Khả năng nhiễm chất hóa học và ô nhiễm cao. · Mang ..."
Sữa bò và sữa hạt loại nào tốt hơn? - Nhà thuốc 365,https://nhathuoc365.vn/sua-bo-va-sua-hat-loai-nao-tot-hon-nd1732,"Sữa bò - loại thực phẩm lâu đời và được ưa chuộng hàng nghìn năm nay là nguồn canxi, protein và vitamin D tuyệt vời. Những dưỡng chất này đặc biệt cần thiết cho ..."
Những lợi ích và tác hại của sữa bò | Báo Dân trí,https://dantri.com.vn/doi-song/nhung-loi-ich-va-tac-hai-cua-sua-bo-20190410142713674.htm,"10 thg 4, 2019 — 10 thg 4, 2019(Dân trí) - Con người đã uống sữa bò hàng thiên niên kỷ nhưng liệu có phải sữa bò tốt cho tất cả mọi người? · 1. Người cần giảm cân · 2. Người có ..."
Sữa bò gây tranh cãi trong suốt 10.000 năm qua - Dinh dưỡng,https://zingnews.vn/vi-sao-sua-bo-la-thuc-pham-gay-nhieu-tranh-cai-suot-10000-nam-qua-post911512.html,"25 thg 1, 2019 — 25 thg 1, 2019Sữa bò có lợi và an toàn cho bò con. Nó giúp cho chúng phát triển từ bò con lên kích cỡ ngang với bò trưởng thành chỉ trong vòng một năm vì ..."
Sữa bò cho trẻ em - dùng thế nào cho hợp lý?,https://tuoitre.vn/sua-bo-cho-tre-em-dung-the-nao-cho-hop-ly-2018042110305351.htm,"21 thg 4, 2018 — 21 thg 4, 2018Với trẻ không uống sữa bò, cha mẹ có thể khuyến khích bé dùng các chế phẩm sữa như phô-mai, sữa chua hoặc các thực phẩm giàu canxi và vitamin D ..."
Nutri ALL - Thành phần dinh dưỡng: Sữa bò tươi,https://vikinutri.com/thuc-pham/sua-va-san-pham-che-bien-tu-sua/sua-bo-tuoi,"31 thg 5, 2022 — 31 thg 5, 2022Sữa bò tươi ; Vitamin PP, 0.1 mg ; Vitamin B5, 0.362 mg ; Vitamin B6, 0.036 mg ; Vitamin B9 (Folat), 5 µg ; Vitamin H (Biotin), 1.4 µg."
"Sữa Bò Tươi Dinh Dưỡng, Chất Lượng, Giá Tốt - Lazada",https://www.lazada.vn/shop-Sua-bo/,"Mua Sữa Bò tươi, sữa bò tiệt trùng tiệt trùng uy tín từ Dutch Lady, TH True Milk, VinaMilk,... tốt cho sức khoẻ. Mua Sữa Chất Lượng tại Lazada giá tốt, ..."
Uống sữa bò tốt hơn hay sữa đậu nành tốt hơn? - BBC,https://www.bbc.com/vietnamese/vert-fut-51020897,"12 thg 1, 2020 — 12 thg 1, 2020Sữa bò là nguồn protein và canxi tốt, cũng như các dưỡng chất như vitamin B12 và i-ốt. Sữa bò cũng có chứa ma-giê, quan trọng cho phát triển ..."
Lợi tích của sữa bò tươi đối với sức khỏe - Long Châu,https://nhathuoclongchau.com.vn/bai-viet/loi-tich-cua-sua-bo-tuoi-doi-voi-suc-khoe-69395.html,"30 thg 1, 2023 — 30 thg 1, 2023Một ly sữa bò tươi nguyên chất 250ml chứa: 28% (276mcg) nhu cầu canxi hàng ngày. 24% (205mcg) phốt pho. 15% (112mcg) vitamin A ..."
6 tác dụng tuyệt vời của sữa bò tươi đối với sức khỏe,https://www.mcmilk.com.vn/6-tac-dung-tuyet-voi-sua-bo-tuoi-voi-suc-khoe/,"6 thg 12, 2018 — 6 thg 12, 2018Sữa bò tươi có chứa một lượng dồi dào canxi, protein, các vitamin nhóm B, vitamin D cùng nhiều khoáng chất khác tốt cho cơ thể con người như ..."
"Cách bảo quản sữa bò tươi được lâu, giữ nguyên hương vị ...",https://www.dienmayxanh.com/vao-bep/cach-bao-quan-sua-bo-tuoi-duoc-lau-giu-nguyen-huong-vi-nhu-14992,"18 thg 11, 2021 — 18 thg 11, 2021Sữa bò tươi nguyên chất là một nguyên liệu thơm ngon và vô cùng bổ dưỡng. Dù vậy, nếu không biết cách bảo quản thì loại sữa này rất dễ bị ..."
Nên uống sữa thực vật hay sữa bò? - Báo Lao Động,https://laodong.vn/dinh-duong-am-thuc/nen-uong-sua-thuc-vat-hay-sua-bo-1057157.ldo,"18 thg 6, 2022 — 18 thg 6, 2022Sữa bò là sản phẩm chứa nhiều chất dinh dưỡng như: protein, canxi, riboflavin và kali. Ngoài ra, lượng chất béo có trong sữa bò thường thay ..."
"Uống sữa bò có tốt không, những tác hại của sữa bò mà bạn ...",https://www.thehinh.com/2017/07/uong-sua-bo-co-tot-khong.html,"17 thg 4, 2020 — 17 thg 4, 2020Sữa bò có lượng Cholesterol cao và gây gia tăng bệnh tim, đột quỵ, tiểu đường và béo phì. Vì trong chuỗi thức ăn phức tạp, sữa vẫn ở mức cao về ..."
Sữa bò úc có tốt không ? Có gì khác so với các dòng sữa khác ?,https://biostime.vn/sua-bo-uc-co-tot-khong/,2 Sữa bò úc có tốt không? 3 Các thương hiệu sữa bò Úc được yêu thích nhất hiện nay. 3.1 Sữa Biostime; 3.2 Sữa Bubs Úc ...
Uống sữa bò có tốt không? Những sai lầm cần tránh khi sử ...,https://wheyshop.vn/giai-dap-thac-mac-uong-sua-bo-co-tot-khong.html,"Sữa bò, sữa trâu và sữa dê thuộc loại sữa có casein, vì tỷ lệ casein chiếm hơn 75% tổng lượng protein. Casein chứa tất cả các axit amin cần thiết, và đặc biệt ..."
Sữa bò: Đừng bạ đâu uống đó - DairyVietnam,https://www.dairyvietnam.com/vn/Goc-nhin-chuyen-gia/Sua-bo-Dung-ba-dau-uong-do.html,"Sữa bò là thực phẩm được sử dụng phổ biến vì chứa nhiều chất đạm, vitamin, canxi cần thiết cho cơ thể. Với thành phần dinh dưỡng đa dạng, sữa bò rất quan ..."
Có nên cho trẻ sơ sinh uống sữa bò không,https://www.vista.gov.vn/news/khoa-hoc-doi-song/co-nen-cho-tre-so-sinh-uong-sua-bo-khong-5159.html,"23 thg 6, 2022 — 23 thg 6, 2022- Trong sữa bò có chứa các protein mà trẻ sơ sinh khó tiêu hóa, nhưng lại thiếu vitamin và khoáng chất quan trọng, chẳng hạn như sắt, mà bé cần ..."
2KG SỮA MỚI VẮT – 50K - Goodmilk,https://goodmilk.vn/san-pham/sua-bo-tuoi/,Vì cấu trúc là sữa bò tự nhiên 100% nên khi rã đông thì sữa không bị tách lớp. Sữa vẫn ngon bình thường; rã đông không làm giảm chất lượng của sữa.
Lợi ích chuyển từ sữa bò sang uống sữa hạt - KHouse,https://khouse.com.vn/loi-ich-chuyen-tu-sua-bo-sang-uong-sua-hat/,"Không thể phủ nhận một điều rằng, Người Mỹ đang dần hạn chế các sản phẩm từ sữa động vật. Ở thời điểm hiện tại, nhu cầu về sữa động vật (chủ yếu là sữa bò) ..."
"Sữa bò: tin tức, hình ảnh, video, bình luận - Thanh Niên",https://thanhnien.vn/sua-bo.html,"Tin nhanh, hình ảnh, video clip, bình luận mới về Sữa bò. Cập nhật nhiều tin tức độc quyền 24h về Sữa bò nhanh và nóng nhất liên tục trong ngày."
Sữa đậu nành hay sữa bò bổ dưỡng hơn? Câu trả lời khiến ...,https://kenh14.vn/sua-dau-nanh-hay-sua-bo-bo-duong-hon-cau-tra-loi-khien-nhieu-nguoi-phai-chon-lai-20221218001506175.chn,"18 thg 12, 2022 — 18 thg 12, 2022Sữa đậu nành. (Ảnh minh họa). Chất đạm. Cứ 100 gam sữa bò tươi chứa khoảng 3,6 gam protein, trong ..."
Sữa – Wikipedia tiếng Việt,https://vi.wikipedia.org/wiki/S%E1%BB%AFa,"Sữa đậu nành có nhiều protein tốt, và nếu được bổ sung calci, thì chất dinh dưỡng của sữa đậu nành có thể sánh ngang tầm với sữa bò. Các loại sữa thực vật khác ..."
Sữa Bò - Goodfood,https://goodfood.com.vn/vi/products/cow-milk-vi/,Sữa Bò. Sản phẩm · Thức Uống; Sữa Bò ... Sữa Tươi Tiệt Trùng Không Béo 200ML. Xuất xứ: Ireland ... Sữa Tươi Tiệt Trùng Nguyên Kem 200 ml. Xuất xứ: Ireland.
Khoa học đã chỉ ra: Ngưng uống sữa vì 8 lý do này,https://suckhoecong.vn/khoa-hoc-da-chi-ra-tac-hai-cua-sua-bo-va-ngung-uong-sua-vi-8-ly-do-nay-d45978.html,"Protein, đường, chất béo bão hòa có trong sữa bò có thể gây béo phì, đái tháo đường, hình thành các mảng bám xơ vữa động mạch có thể dẫn đến bệnh tim ở trẻ ..."
Khi nào bé có thể uống được sữa bò tươi? - Wellcare.vn,https://wellcare.vn/me-va-be/khi-nao-be-co-the-uong-duoc-sua-bo-tuoi,Sau đây là một số thông tin chia sẻ để các phụ huynh lựa chọn. Image result for sá»¯a bÃ² tÆ°Æ¡i. Sữa bò tươi. (Ảnh minh họa). Hệ ...
Khi nào bé có thể uống được sữa bò tươi? - Wellcare.vn,https://wellcare.vn/me-va-be/khi-nao-be-co-the-uong-duoc-sua-bo-tuoi,Sau đây là một số thông tin chia sẻ để các phụ huynh lựa chọn. Image result for sá»¯a bÃ² tÆ°Æ¡i. Sữa bò tươi. (Ảnh minh họa). Hệ ...
So sánh sữa hạt và sữa bò có gì khác nhau? Loại nào tốt hơn?,https://www.avakids.com/me-va-be/so-sanh-sua-hat-va-sua-bo-co-gi-khac-nhau-loai-1450876,"Sữa bò được xem là nguồn dinh dưỡng rất tốt bởi cung cấp nhiều Canxi, Protein và Vitamin D hỗ trợ bé phát triển hệ xương răng và tăng cân ổn định. Trong sữa bò ..."
Sữa bò có tác dụng gì? Mặt trái của sữa bò với sức khỏe,https://sieuthihanguc.net/sua-bo/,"1 thg 2, 2021 — 1 thg 2, 2021Sữa bò bao nhiêu calo? ; Kali, 322 mcg, 10% ; Vitamin B12, 1,10 mcg, 18% ; Kẽm, 0,9 mcg, 11% ; Protein, 6-7 g, 14%."
Uống sữa bò tươi vào buổi tối có tốt cho sức khỏe không?,https://www.suabotamthuan.com/uong-sua-bo-tuoi-vao-buoi-toi-co-tot-cho-suc-khoe-khong,"Vì trong thành phần sữa tươi có Truytophan, một axit amin cần thiết để sản xuất ra các chất kích thích giấc ngủ là Serotonin và melatonin, giúp bạn nhanh chóng ..."
Giải pháp an toàn cho bé dị ứng đạm sữa bò - VitaDairy,https://vitadairy.vn/sua-cho-be-di-ung-dam-sua-bo-v11t108.html,"10 thg 10, 2019 — 10 thg 10, 2019Dị ứng đạm sữa bò ở trẻ xảy ra khi hệ thống miễn dịch trong cơ thể trẻ cho rằng các thành phần protein trong sữa bò là có hại, từ đó cơ thể sẽ ..."
Dị ứng sữa bò liệu có dị ứng sữa dê ?,https://suckhoedoisong.vn/di-ung-sua-bo-lieu-co-di-ung-sua-de-169211005205923714.htm,"6 thg 10, 2021 — 6 thg 10, 2021Ngoại trừ một ít sự khác biệt như trong sữa dê năng lượng nhiều hơn, có nhiều Vitamin A và Kali thì trong sữa bò lại có nhiều Selen, Vitamin B12 ..."
Tại sao Sữa bò có màu trắng? - SOLOMON INTERNATIONAL,https://solomonorganic.com/tin-tuc/120/tai-sao-sua-bo-co-mau-trang.html,"Tất cả mọi loại sữa đều chứa protein, chất béo, đường lactose, khoáng và vitamin. Sữa của các động vật không giống nhau, sữa bò thì có 87% là nước và gần 4% ..."
Dị ứng đạm sữa bò là gì và dấu hiệu nhận biết - Medlatec,https://medlatec.vn/tin-tuc/di-ung-dam-sua-bo-la-gi-va-dau-hieu-nhan-biet-s62-n29227,"25 thg 7, 2022 — 25 thg 7, 2022Dị ứng đạm sữa bò là một dạng dị ứng thực phẩm phổ biến ở trẻ em, trong đó có nhiều trẻ sơ sinh mắc bệnh gây ra nhiều phản ứng bất thường ..."
Hậu họa của việc uống sữa bò đối với trẻ - Shop Bà Điểm,https://shopbadiem.com/hau-hoa-cua-viec-uong-sua-bo-voi-tre/,Sữa có chứa các yếu tố tăng trưởng tương tự như insulin (IGF-1) có liên quan đến ung thư và tử vong sớm. 3. Độc tố trong sữa. Sữa bò có thành phần dinh dưỡng ...
Sữa bò và sữa đậu nành: Đặt lên cân hai loại sữa được ưa ...,https://cafef.vn/sua-bo-va-sua-dau-nanh-dat-len-can-hai-loai-sua-duoc-ua-chuong-xem-sua-nao-noi-troi-hon-2020112716503902.chn,"27 thg 11, 2020 — 27 thg 11, 2020Sữa đậu nành chứa nhiều protein ngang sữa bò, nhưng lại ít calo hơn. Một số sản phẩm sữa đậu nành được bổ sung vitamin A, B-12, D và canxi."
Thực hư chuyện sữa dê tốt hơn sữa bò? - FoodMap.Asia.,https://foodmap.asia/tin-tuc/thuc-hu-chuyen-sua-de-tot-hon-sua-bo,"Bên cạnh đó, một protein casein gây dị ứng lại được tìm thấy trong sữa bò. #3: Trẻ dung nạp lactose của sữa dê tốt hơn sữa bò. Dựa vào bảng thành phần trên, ..."
Con tôi có bị mẫn cảm với đạm sữa bò hay không?,https://www.kabrita.vn/blogs/sua-de/con-toi-co-bi-man-cam-voi-dam-sua-bo-hay-khong,"10 thg 8, 2022 — 10 thg 8, 2022Trẻ phản ứng với sữa bò ở những mức độ khác nhau có thể gây ra nhiều vấn đề sức khỏe. Cùng sữa dê Kabrita tìm hiểu nguyên nhân và hướng giải ..."
Sữa bò non là gì? Những điều có thể chưa biết về sữa bò non,https://www.hangngoainhap.com.vn/tin-tuc-302-sua-bo-non-la-gi-nhung-dieu-co-the-chua-biet-ve-sua-bo-non.html,Đây là dạng sữa cao cấp cung cấp hàm lượng chất dinh dưỡng dồi dào trong 1 thể tích dung dịch thấp. Sữa bò non còn có tên gọi khác là sữa đầu. sua bo non la gi.
Sữa Bò Tươi - vitabean.vn,https://vitabean.vn/sua-bo-tuoi.html,"✓ Hàm lượng dinh dưỡng : như vitamin D, Riboflavin, vitamin B12, canxi và phốt pho …. ✓ Ứng dụng: Sữa bò tươi được sử dụng trong các thức uống dinh dưỡng , ..."
10.000 năm con người trải nghiệm uống sữa bò - VnExpress,https://vnexpress.net/10-000-nam-con-nguoi-trai-nghiem-uong-sua-bo-3959446.html,"29 thg 7, 2019 — 29 thg 7, 2019Đến khi cai sữa, phần lớn chúng ta ngừng tiết ra lactase. Không có enzyme này, con người không thể tiêu hóa hoàn toàn lactose trong sữa. Vì thế, ..."
Phần 1: Sữa Bò và Nguy Cơ Ung Thư - Ruy Băng Tím,https://ruybangtim.com/chuyen-de-sua-va-benh-ung-thu-phan-1-sua-bo-va-nguy-co-ung-thu/,"3 thg 6, 2016 — 3 thg 6, 2016Sữa bò cung cấp chất đạm, canxi, vitamin D và kali, giúp xương, răng và cơ phát triển chắc khoẻ (1). Tuy nhiên, hiện nay nhiều thông tin trên ..."
Sữa bò hữu cơ tách béo Grandeur Nature 1L - Pncom,https://pncom.vn/sua-bo-huu-co-tach-beo-grandeur-nature-1l,"Thành phần: 100% sữa tách béo* *Từ nông nghiệp hữu cơ Xuất xứ: Pháp Điểm nổi bật của sản phẩm: Phù hợp với mọi lứa tuổi (trẻ em từ 12 tháng trở đi), ..."
6 tác dụng tuyệt vời của sữa bò đối với sức khỏe mà bạn cần ...,https://songkhoe.medplus.vn/6-tac-dung-tuyet-voi-cua-sua-bo-doi-voi-suc-khoe-ma-ban-can-biet/,"Sữa bò có nhiều protein, vitamin B, vitamin D, các khoáng chất khác nhau. Các hợp chất hữu cơ và chất chống oxy hóa có thể ảnh hưởng và kích thích cơ thể theo ..."
Sữa bò Organic Mart,https://organicmart.com.vn/sua-bo,Sữa bò hữu cơ Nguyên Kem Koita 200ml. 38.000₫. Sữa nguyên kem Valley 200ml. 44.000₫. Sữa hữu cơ vị dâu 200ml Daioni. 38.000₫. Sữa hữu cơ tách béo 1L Daioni.
Hoang mang trước khuyến cáo người Việt không nên uống ...,https://afamily.vn/cong-dong-cac-me-bim-sua-hoang-mang-truoc-khuyen-cao-cua-chuyen-gia-dinh-duong-nguoi-viet-khong-nen-uong-sua-bo-20210519104850839.chn,"21 thg 5, 2021 — 21 thg 5, 2021Trong đó, có một chi tiết đáng chú ý: ""Tỉ lệ người Việt hấp thụ kém đường lactose trong sữa bò cao tới 98% (so với 73% người Nhật, 36% người Mỹ, ..."
"Sữa dê và sữa bò loại nào tốt hơn cho bé, bài viết này sẽ giải ...",https://suahoanggia.vn/sua-de-va-sua-bo-loai-nao-tot-hon-cho-be-bai-viet-nay-se-giai-dap-cho-ban-nd343,"Ngoài ra, sữa bò cũng chứa tỷ lệ cao các axit amin thiết yếu, vitamin phong phú, đa dạng như vitamin A, vitamin nhóm B, vitamin D… các khoáng chất quan trọng ..."
So sánh sữa Dê và sữa Bò loại nào tốt giúp bé tăng cân?,https://suabottot.com/so-sanh-sua-de-va-sua-bo-loai-nao-tot-giup-be-tang-can/,"Trong sữa bò, protein Casein as1 là nguyên nhân chính gây ra dị ứng đạm sữa mà nhiều trẻ em đang gặp phải. Để giải quyêt vấn đề này thì trẻ có thể sử dụng các ..."
Công nghiệp bò sữa: Nước mắt của bò mẹ - máu của bò con,https://m.facebook.com/media/set/?set=a.581596098518116.1073741827.548330658511327&type=3,"sẽ sản sinh ra 1 loại sữa thơm ngon và bổ dưỡng sao? 2. Sữa bò có nhiều canxi nhưng cũng chứa PCBs và các chất ô nhiễm công nghiệp khác, steroid hormone (sữa ..."
Bé 10 tháng rưỡi dị ứng đạm sữa bò,https://tamanhhospital.vn/tu-van/be-10-thang-ruoi-di-ung-dam-sua-bo/,"Khi trẻ em bị dị ứng đạm sữa bò, nếu bé còn bú mẹ thì bạn không nên dùng sữa bò hoặc các chế phẩm từ sữa; mỗi ngày bạn cần bổ sung thêm vitamin D và canxi để ..."
NÊN HAY KHÔNG BỎ SỮA KHỎI CHẾ ĐỘ DINH DƯỠNG?,https://droh.co/nen-hay-khong-bo-sua-khoi-che-do-dinh-duong/,"26 thg 2, 2023 — 26 thg 2, 2023Từ hàng thập kỷ trước đến nay, người tiêu dùng luôn được tiếp cận với những thông tin tích cực về sữa bò. nen-hay-khong-bo-sua-khoi-che-do-."
Giá trị dinh dưỡng từ Sữa bò và các sản phẩm làm từ Sữa bò,https://www.foodnk.com/gia-tri-dinh-duong-tu-sua-bo-va-cac-san-pham-lam-tu-sua-bo.html,"10 thg 8, 2021 — 10 thg 8, 2021Trong sữa bò chứa khoảng 3,4% protein, 3,7% chất béo, 4,5% lactose và nước chiếm tới 87,4%. Tuy nhiên một số khoáng chất như sắt hay các vitamin ..."
Sữa non của bò là gì và tác dụng của sữa non của bò,https://domy.vn/d2130-sua-non-cua-bo-la-gi-va-tac-dung-cua-sua-non-cua-bo.html,Sữa bò non là một loại sữa được sản xuất bởi những con bò cái vừa sinh con và chỉ tồn tại vài ngày ... Sữa bò non Úc Healthy Care Colostrum Milk Powder 300g.
Sữa bò non Úc - Ausmart.vn,https://ausmart.vn/sua-bo-non-uc,"Tình trạng này xảy ra khi hệ thống miễn dịch của cơ thể nhầm lẫn một chất vô hại – protein sữa bò – thành một chất có hại. Từ đó, kích thích cơ thể sản xuất ..."
Biểu hiện dị ứng đạm sữa bò ở trẻ thường gặp - Imiale,https://imiale.com/bieu-hien-di-ung-dam-sua-bo-14349/,Dị ứng đạm sữa bò (cow's milk allergy) còn được gọi là dị ứng protein sữa bò xảy ra khi hệ miễn dịch của trẻ có những phản ứng quá nhạy cảm với thành phần đạm ...
Kẹo Sữa Bò Non Viên Nén 250g - Cao Nghệ Fruit,https://traicaycaonghe.vn/keo-sua-bo-non-vien-nen-250g/,"Kẹo sữa bò non đặc sản Mông Cổ Siêu thơm siêu béo… Bổ sung canxi cho bé nào lười uống sữa, người lớn trẻ con ai cũng mê… Keosuabo8. Kẹo tiếp xúc với không ..."
tác hại của sữa bò với trẻ em không ai ngờ tới - Elipsport,https://elipsport.vn/tin-tuc/tac-hai-cua-sua-bo-voi-tre-em-khong-ai-ngo-toi_10416.html,"Theo chuyên gia dinh dưỡng, trẻ nên vẫn nên uống sữa bò để cung cấp vitamin A, B12, D, kali, canxi, protein, nhưng phải uống với lượng phù hợp. Nếu bạn muốn bé ..."
Lưu ý khi uống sữa bò - VTC News,https://vtc.vn/luu-y-khi-uong-sua-bo-ar108284.html,"4 thg 3, 2013 — 4 thg 3, 2013Axit oxalic trong đường đỏ sẽ làm biến chất protein trong sữa bò, khiến cho chức năng tiêu hóa bị “mất thăng bằng”, thậm chí cản trở sự hấp thụ ..."
"Uống sữa bò gây mụn, đúng hay sai? - HoangHac",https://hoanghac.vn/uong-sua-bo-gay-mun-dung-hay-sai/,"Nguyên nhân là do trong sữa bò có chất nội tiết Androgen làm tăng cường hoạt động của tuyến bã, dẫn đến tăng bài tiết chất bã và tắc lỗ nang lông – yếu tố hàng ..."
Pastiri - Phô mai sữa bò trắng (200g) - Classic Deli,https://classicdeli.vn/hanoi/vn/bo-sa/90-feta-cheese-200g-cow.html,"Pastiri - Phô mai sữa bò trắng (200g). ₫119,000. Thuế. Số lượng. Add to cart. secure payment. High quality products. Express shipping. Phô mai (200g)."
Dậy thì sớm do sữa bò | BvNTP - Bệnh viện Nguyễn Tri Phương,https://bvnguyentriphuong.com.vn/dinh-duong/day-thi-som-do-sua-bo,"Ban đầu, rBGH - hormon tăng trưởng tái tổ hợp cho bò (recombinant bovine growth hormon) (dùng để kích sữa thêm 10%) được coi là tội đồ. Tiến sĩ Paul Kaplowitz - ..."
TEST SỮA BÒ Ở ĐÂU,https://phongkhamnhidrthieu.com/dich-vu/lam-test-sua-bo-khi-nao-63.html&p=4,"LÀM TEST SỮA BÒ KHI NÀO. TS.BS Hà Văn Thiệu. 579A Đỗ Xuân Hợp, quận 9. Bài này chỉ dành cho trẻ dị ứng sữa bò tham khảo. PHÒNG KHÁM NHI ĐỒNG BS."
Sữa bò hữu cơ Koita ít béo vị dâu 200ml - Bibomart,https://bibomart.com.vn/sua-bo-huu-co-koita-it-beo-vi-dau-200ml.html,"- Sữa bò hữu cơ ít béo (90%), dâu tây hữu cơ 3%, đường nâu hữu cơ, hương vị dâu tự nhiên, vitamin A, vitamin D3,.. Đặc điểm nổi bật của sản phẩm. Nguồn nuôi ..."
Sữa Bò Tươi Long Thành - Võ Thị Sáu ở TP. HCM - Foody.vn,https://www.foody.vn/ho-chi-minh/sua-bo-tuoi-long-thanh-vo-thi-sau,Sữa bò Long Thành chất lượng ngon đều trên tất cả chi nhánh. Tươi là ưu điểm vượt trội hàng đầu khi nhắc tới thương hiệu sữa bò này. Hồi đó mình uống sữa ...
Sữa bò tươi nguyên chất - Thực phẩm Việt Nam | Thịt gà,https://thucphamvietnam.com.vn/sua-bo-tuoi-nguyen-chat-1,"Sữa bò còn là nguồn protein tốt cực kỳ dồi dào, chứa nhiều chất thiết yếu cho cơ thể. * Nguồn gốc: Sữa bò tươi nguyên chất 100% trang trại bò sữa Đông Anh, Hà ..."
Giải mã: Uống sữa bò có tăng chiều cao không?,https://nubest.vn/uong-sua-bo-co-tang-chieu-cao-khong,"17 thg 2, 2023 — 17 thg 2, 2023Uống sữa bò hằng ngày mang đến nhiều lợi ích sức khỏe thiết thực: - Xương chắc khỏe: Hàm lượng cao Canxi và vitamin D trong sữa bò sẽ giúp hệ ..."
So sánh chất lượng sữa dê và sữa bò - Saigon Times,https://thesaigontimes.vn/so-sanh-chat-luong-sua-de-va-sua-bo/,"Sữa dê có thể chuyển hóa carotin thành các vitamin A, tạo ra màu trắng ở sữa. Vitamin B được tổng hợp ở trong dạ cỏ của bò và dê thường phụ thuộc vào nguồn thức ..."
"Sữa đậu nành và sữa bò, đâu là loại sữa phù hợp với bạn?",https://www.elle.vn/bi-quyet-khoe-va-dep/sua-dau-nanh-va-sua-bo,"12 thg 9, 2021 — 12 thg 9, 2021Ngoài ra, sữa còn bổ sung vitamin A, B12, D và canxi, giúp xương chắc khoẻ. Lượng đạm gần bằng với sữa bò nhưng lượng calo lại thấp hơn, phù hợp ..."
Chuyển giao công nghệ sữa bò tươi thanh trùng đóng chai ...,https://www.vinaorganic.com/san-pham/chuyen-giao-cong-nghe-sua-bo-tuoi-thanh-trung-dong-chai-vinaorganic,VinaOrganic giới thiệu công nghệ sữa bò tươi thanh trùng chất lượng cao lưu giữ tối đa thành phần dinh dưỡng và hương vị thơm ngon đặc trưng của sữa tươi.
6 lý do khiến bạn muốn chuyển ngay từ sữa bò sang uống ...,https://suckhoegiadinh.com.vn/dinh-duong/6-ly-do-khien-ban-muon-chuyen-ngay-tu-sua-bo-sang-uong-sua-hat-27387/,"20 thg 6, 2019 — 20 thg 6, 2019Bò mẹ khóc thét trong đau khổ khi bê con bị tách mẹ ngay khi vừa sinh. 6 ly do khien ban muon chuyen ngay tu sua bo sang uong sua hat. Những con ..."
Startup tạo ra sữa bò mà không cần bò,http://vjst.vn/vn/tin-tuc/5197/startup-tao-ra-sua-bo-ma-khong-can-bo.aspx,"25 thg 8, 2021 — 25 thg 8, 2021Cụ thể, Perfect Day đã tập hợp gen mã hóa whey protein trong sữa bò và đưa nó vào một loại nấm. Khi nấm được phát triển trong các thùng lên men, ..."
