title,link,description
"Sữa bò đặc nhập khẩu malaysia giá tốt, giảm giá đến 40% - Tiki",https://tiki.vn/search?q=s%E1%BB%AFa%20b%C3%B2%20%C4%91%E1%BA%B7c%20nh%E1%BA%ADp%20kh%E1%BA%A9u%20malaysia,"Sữa bò đặc nhập khẩu malaysia giảm giá đến 40%, hàng chính hãng, cam kết hoàn tiền 111% nếu hàng giả, freeship, giao nhanh 2h, nhiều mã giảm giá hôm nay."
Vì sao người tiêu dùng phương Tây từ bỏ sữa bò,https://www.tinnhanhchungkhoan.vn/vi-sao-nguoi-tieu-dung-phuong-tay-tu-bo-sua-bo-post225133.html,"14 thg 11, 2019 — 14 thg 11, 2019Tuy nhiên, Guardian cho biết trong vài năm qua, người tiêu dùng phương Tây đã hạn chế tiêu thụ sữa bò. Ngày 12/11, Dean Foods - công ty sữa ..."
Sữa Bò Hữu Cơ Holle 4 Dành Cho Trẻ Sau 12 Tháng 600g,https://theanorganics.com/shop/me-be/suc-khoe-be/sua-bo-huu-co-holle-4-danh-cho-tre-sau-12-thang-600g/,Sữa bò hữu cơ Holle 4 dành cho trẻ sau 12 tháng 600g. 480.000 ₫. Mua sản phẩm này bạn sẽ nhận. 480 Anxu từ chương trình ...
Sữa bò hữu cơ tách kem Daioni vị chocolate 200mL,https://thucphamorganic.vn/sua-bo-huu-co-tach-kem-daioni-vi-chocolate-200ml/,"Daioni là nhãn hiệu sữa bò hữu cơ nổi tiếng đạt chứng nhận tiêu chuẩn Organic, chất lượng mang đến giá trị sử dụng cao nhất."
Nâng tầm giá trị sản phẩm sữa bò Tam Đảo - Vĩnh Phúc,https://vinhphuc.gov.vn/ct/cms/tintuc/Lists/KinhTe/View_Detail.aspx?ItemID=11397,"1 thg 8, 2022 — 1 thg 8, 2022Cuối năm 2021, Công ty cổ phần dinh dưỡng Nutricare đã ký hợp đồng thu mua sữa bò nguyên liệu của hợp tác xã. Năm 2022, khi du lịch bắt đầu mở ..."
Bé dị ứng đạm sữa bò: Dấu hiệu và cách xử lý đúng,https://benhvienphuongdong.vn/be-di-ung-dam-sua-bo/,"13 thg 10, 2022 — 13 thg 10, 2022Nó thường xảy ra với các bé đã từng uống sữa bột trước đây. Nếu cơ thể của bé nhận diện sai những thành phần protein có trong sữa bò là các ..."
Sữa bò có tốt không? Những lợi ích và tác hại của sữa bò,https://caodangyduochochiminh.vn/tin-tuc-y-duoc/sua-bo-co-tot-khong-nhung-loi-ich-va-tac-hai-cua-sua-bo-c52960.html,"19 thg 5, 2020 — 19 thg 5, 2020Với trẻ em thì sữa bò thực sự tốt, nhất là với những trẻ giai đoạn trưởng thành. Bởi đây là nguồn canxi rất tốt giúp làm tăng cường mật độ xương ..."
TẤT TẦN TẬT về Đặc Sản Sữa Bò Long Thành Đồng Nai,https://cuongdulich.com/dia-diem/2635-bo-sua-long-thanh.html,"Cách phân biệt bò sữa Long Thành của mình: Tên cty sx là Healthy milk, của bò sữa Long Thành là Lothamilk. Sữa Healthy milk ko có hạn dùng, có in ..."
"So sánh: Sữa dê hay sữa bò tốt hơn, nên mua loại nào?",https://websosanh.vn/tin-tuc/so-sanh-sua-de-hay-sua-bo-tot-hon-c37-20211231054030399.htm,"31 thg 12, 2021 — 31 thg 12, 2021Ngoài ra, sữa bò có hàm lượng cao các axit amin thiết yếu và vitamin A, nhóm B, D,… cùng các khoáng chất quan trọng như canxi, sắt, magie, ..."
MEIJI- Sữa cho bé dị ứng đạm sữa bò 850g,https://sakukostore.com.vn/meiji-sua-cho-be-di-ung-dam-sua-bo-850g,"Dành cho trẻ bị dị ứng với sữa bò, đạm đậu nành và trứng. Bổ sung hàm lượng cao các vitamin cùng khoáng chất cho bé từ 0 tuổi. Sữa có mùi thơm, vị."
Muối Tắm Tẩy Tế Bào Chết Chiết Xuất Sữa Bò A Bonne Spa ...,https://lamthaocosmetics.vn/products/muoi-tam-sua-bo-tay-te-bao-chet-a-bonne-spa-milk-salt,"Với thành phần chiết xuất từ tinh chất từ Sữa bò, yogurt, vitamin C và nhiều dưỡng chất khác, A Bonne Spa Milk Salt có công dụng tẩy sạch tế bào chết và bụi ..."
Uống sữa bò có giúp trẻ tăng chiều cao hay không? - Biohome,https://biohome.vn/uong-sua-bo-co-giup-tre-tang-chieu-cao-hay-khong,"20 thg 4, 2021 — 20 thg 4, 2021Trong thành phần của Sữa là có chứa rất nhiều đạm và các dưỡng chất như Canxi, Magie, Kẽm, Photpho, Vitamin,… Hầu hết các chất này đều có tác ..."
Dinh dưỡng cho trẻ dị ứng đạm sữa bò.,https://bvndtp.org.vn/dinh-duong-cho-tre-di-ung-dam-sua-bo/,"18 thg 5, 2020 — 18 thg 5, 2020Một tỉ lệ cao trẻ dị ứng đạm sữa bò dẫn đến tình trạng suy dinh dưỡng do rất nhiều nguyên nhân: Trẻ có tình trạng kém hấp thu;; Trẻ không nhận ..."
9 sai lầm khi dùng sữa bò - Báo Người lao động,http://nld.com.vn/suc-khoe/9-sai-lam-khi-dung-sua-bo-233264.htm,"25 thg 7, 2008 — 25 thg 7, 2008Vì vậy, khi uống sữa nên chú ý độ tuổi của bé để có 1 ly sữa tốt nhất. 2. Cho càng nhiều đường càng ngon Liều lượng thích hợp là cứ 100ml sữa bò ..."
Con người có thể dùng sữa gián thay cho sữa bò - Vietnamnet,https://vietnamnet.vn/con-nguoi-co-the-dung-sua-gian-thay-cho-sua-bo-589654.html,"19 thg 11, 2019 — 19 thg 11, 2019Sữa gián là nguồn thực phẩm chứa nhiều chất đạm và các axit amin cần thiết cho cơ thể, với lượng protein nhiều hơn trong sữa bò."
"Sữa bò, Trẻ em, “Bẫy Canxi”, “Bẫy protein” và chứng rụng tóc ...",https://trongkhuvuon.com/sua-bo-tre-em-bay-canxi-bay-protein-va-chung-rung-toc-hoi-dau/,"14 thg 2, 2022 — 14 thg 2, 2022Vì sao? 2.1 Enzyme để xử lý sữa bò. Cơ thể con người không sản xuất ra lượng enzyme để xử lý sữa bò nhiều như một con bò sản ..."
Điểm danh 4 loại sữa hạt có thể thay thế cho sữa bò,https://greenbox-online.com/blogs/khoe-dep-moi-ngay/diem-danh-4-loai-sua-hat-co-the-thay-the-cho-sua-bo,"11 thg 3, 2022 — 11 thg 3, 2022Sữa bò rất giàu protein, các vitamin và khoáng chất quan trọng, bao gồm canxi, phốt pho và vitamin B. Trên thực tế, một cốc sữa bò nguyên chất ..."
Đặc sản sữa bò Long Thành - Báo Đồng Nai điện tử,https://baodongnai.com.vn/trangdiaphuong/201911/dac-san-sua-bo-long-thanh-2972746/index.htm,"7 thg 11, 2019 — 7 thg 11, 2019Sữa bò Long Thành là sản phẩm nổi tiếng đã và đang được nhiều người tiêu dùng biết đến thông qua hệ thống các điểm bán lẻ, trạm dừng chân và ..."
Hãy đảm bảo điều này nếu bạn muốn thay thế sữa bò bằng ...,https://www.tteokbokki.vn/blogs/tin-tuc-su-kien/hay-dam-bao-dieu-nay-neu-ban-muon-thay-the-sua-bo-bang-sua-thuc-vat,"20 thg 4, 2020 — 20 thg 4, 2020Các nhà nghiên cứu chỉ ra rằng sữa thực vật bổ sung canxi thường chứa lượng canxi tương tự hoặc thậm chí nhiều hơn sữa bò. Tuy nhiên, cơ thể ..."
Tác dụng tăng cơ không ngờ của sữa bò với người tập Gym,https://thethao247.vn/318-tac-dung-tang-co-khong-ngo-cua-sua-bo-voi-nguoi-tap-gym-d183418.html,"5 thg 7, 2019 — 5 thg 7, 2019- Trong 100 ml sữa bò tươi có chứa khoảng 3,3 g protein. Protein trong sữa bò thường có dạng các axit-amin hoàn chỉnh có thể tạo nên đầy đủ các ..."
Sữa bò tươi có nằm trong danh mục thực phẩm thiết yếu hay ...,https://moit.gov.vn/hoi-dap/sua-bo-tuoi-laptop-va-cac-linh-kien-di-kem-co-nam-trong-danh.html,"28 thg 7, 2021 — 28 thg 7, 2021"
Sữa bò có thực sự là nguyên nhân gây ung thư? Đừng nghe ...,https://tintuconline.com.vn/suc-khoe/sua-bo-co-thuc-su-la-nguyen-nhan-gay-ung-thu-dung-nghe-loi-don-hay-nghe-chuyen-gia-noi-n-340361.html,"9 thg 3, 2018 — 9 thg 3, 2018Sữa bò là nguồn cung cấp calcium và vitamin D dồi dào. Như vậy sữa tốt cho xương, ít nhất là với trẻ em. Nhưng cũng lưu ý rằng, chế độ dinh ..."
"Cắt Hoàn Toàn Sữa Bò, Thay Bằng Sữa Hạt - Coi Chừng Con ...",https://farmersmarket.vn/blogs/news/cat-hoan-toan-sua-bo-thay-bang-sua-hat-coi-chung-con-thieu-chat-coi-xuong,"7 thg 12, 2017 — 7 thg 12, 2017Lo sợ vì sự nguy hiểm của sữa bò, không ít gia đình đã chuyển hoàn toàn sang dùng sữa hạt. Dung sua hat the nao cho dung? hinh anh 1. Sữa hạt có ..."
"Sữa bò có tính nhiệt, không nên uống vào mùa hè?",https://thuocchuabenh.vn/suc-khoe-doi-song/sua-bo-co-tinh-nhiet-khong-nen-uong-vao-mua.html,"Về mùa thu đông, các chất béo, chất protein, chất lactose có trong sữa bò tươi nhiều hơn chút ít; còn về mùa xuân hè thì các thành phần vitamin, chất khoáng và ..."
Sữa dê và sữa bò khác nhau thế nào? - Shop Trẻ Thơ,https://shoptretho.com.vn/tin-tuc/sua-de-va-sua-bo-khac-nhau-the-nao,"5 thg 1, 2015 — 5 thg 1, 2015Đối với sữa bò tự nhiên (chưa qua xử lý đồng nhất) thì enzim này thường được cơ thể bài tiết ra ngoài. sua-bo-va-sua-de-khac-nhau-nhu-. Sữa dê ..."
KOITA SỮA BÒ HỮU CƠ NGUYÊN KEM 1L - Andeli,https://andeli.com.vn/products/koita-sua-bo-huu-co-nguyen-kem-1l,"Thành phần: Sữa bò hữu cơ nguyên kem, vitamin A, Vitamin D3, 3,6% chất béo sữa, tối thiểu 8,5% sữa khô đã tách béo. Đặc điểm nổi bật: Nguồn nuôi dưỡng ngon sạch ..."
